{
  "$schema": "schemas/index-v1.schema.json",
  "schema_version": 1,
  "updated_at": "2026-10-15",
  "repo": "tnunamak/minnows",
  "packs": {
    "model-catalog": {
      "latest_tag": "data-model-catalog-v0.5.15",
      "description": "Model catalog + honesty pass (smoke local rows, comparable flags)",
      "readme": "https://github.com/tnunamak/minnows/blob/main/data/model-catalog/README.md",
      "releases": "https://github.com/tnunamak/minnows/releases?q=data-model-catalog&expanded=true",
      "pack_json": "https://raw.githubusercontent.com/tnunamak/minnows/data-model-catalog-v0.5.15/data/model-catalog/pack.json",
      "tarball": "https://github.com/tnunamak/minnows/releases/download/data-model-catalog-v0.5.15/data-model-catalog-v0.5.15.tar.gz",
      "tree": "https://github.com/tnunamak/minnows/tree/data-model-catalog-v0.5.15/data/model-catalog"
    },
    "model-choice-policy": {
      "latest_tag": "data-model-choice-policy-v0.2.7",
      "description": "Operating points; pins catalog v0.5.15. Owner-authorized trial: public-only OpenCode DeepSeek V4.1 Flash Free is the preferred normal candidate for small public implement.oracle-bounded changes, bounded public test design (purpose test-design), known-source docs.lookup, bounded public status reports (recover.report) and purpose-research fanout.dollar-tight, behind a repo-bound input manifest, checked oracle/judged proof, live low/high/max efforts and required close/repairs/rework accounting. Primary recommendations unchanged; paid arms remain visible fallbacks.",
      "readme": "https://github.com/tnunamak/minnows/blob/main/data/model-choice-policy/README.md",
      "releases": "https://github.com/tnunamak/minnows/releases?q=data-model-choice-policy&expanded=true",
      "pack_json": "https://raw.githubusercontent.com/tnunamak/minnows/data-model-choice-policy-v0.2.7/data/model-choice-policy/pack.json",
      "tarball": "https://github.com/tnunamak/minnows/releases/download/data-model-choice-policy-v0.2.7/data-model-choice-policy-v0.2.7.tar.gz",
      "tree": "https://github.com/tnunamak/minnows/tree/data-model-choice-policy-v0.2.7/data/model-choice-policy"
    },
    "local-evals": {
      "latest_tag": "data-local-evals-v0.1.3",
      "description": "Harness smoke only — not quality evidence",
      "readme": "https://github.com/tnunamak/minnows/blob/main/data/local-evals/README.md",
      "releases": "https://github.com/tnunamak/minnows/releases?q=data-local-evals&expanded=true",
      "pack_json": "https://raw.githubusercontent.com/tnunamak/minnows/data-local-evals-v0.1.3/data/local-evals/pack.json",
      "tarball": "https://github.com/tnunamak/minnows/releases/download/data-local-evals-v0.1.3/data-local-evals-v0.1.3.tar.gz",
      "tree": "https://github.com/tnunamak/minnows/tree/data-local-evals-v0.1.3/data/local-evals"
    },
    "decision-model-catalog": {
      "latest_tag": "data-decision-model-catalog-v0.1.1",
      "description": "Decision models (typed decisions on an agent hot path): source-backed models, scores, pricing, capabilities, latency/cost context and caveats (first release v0.1.0, data as of 2026-10-07)",
      "readme": "https://github.com/tnunamak/minnows/blob/main/data/decision-model-catalog/README.md",
      "releases": "https://github.com/tnunamak/minnows/releases?q=data-decision-model-catalog&expanded=true",
      "pack_json": "https://raw.githubusercontent.com/tnunamak/minnows/data-decision-model-catalog-v0.1.1/data/decision-model-catalog/pack.json",
      "tarball": "https://github.com/tnunamak/minnows/releases/download/data-decision-model-catalog-v0.1.1/data-decision-model-catalog-v0.1.1.tar.gz",
      "tree": "https://github.com/tnunamak/minnows/tree/data-decision-model-catalog-v0.1.1/data/decision-model-catalog"
    }
  }
}
